{
  "id": "0192cae6-000c-7000-8000-000000000001",
  "eval_run_id": "0192cae6-0004-7000-8000-000000000000",
  "session_trace_id": "0192cae6-0005-7000-8000-000000000000",
  "judge_decision_id": "0192cae6-0007-7000-8000-000000000000",
  "supersedes_id": null,
  "reviewer_identity": "jeremy@intentsolutions.io",
  "reviewer_is_service_account": false,
  "score_text": "strong — the skill stays scoped and the examples land; would keep",
  "thumbs": true,
  "annotation": "agrees with the machine PASS; the edge-case section is the keeper",
  "input_hash": "3939393939393939393939393939393939393939393939393939393939393939",
  "created_at": "2026-06-25T00:00:00Z"
}
