{
  "id": "0192cae6-000c-7000-8000-000000000002",
  "eval_run_id": "0192cae6-0004-7000-8000-000000000000",
  "session_trace_id": null,
  "judge_decision_id": "0192cae6-0007-7000-8000-000000000000",
  "supersedes_id": null,
  "reviewer_identity": "reviewer-2@intentsolutions.io",
  "reviewer_is_service_account": false,
  "score_text": null,
  "thumbs": false,
  "annotation": null,
  "input_hash": "4040404040404040404040404040404040404040404040404040404040404040",
  "created_at": "2026-06-25T00:01:00Z"
}
